{
  "schema_version": "0.3.0",
  "suite_id": "ccc-core",
  "evaluation_target": "assistant_output_only",
  "manual_case_count": 48,
  "routing_semantics": {
    "primary_required": "The primary skill is the expected main handler. Secondary skills are allowed helpers, not mandatory unless a semantic assertion explicitly requires their behavior.",
    "route_trace_note": "Plain LLM prompt tests may not expose skill routing logs; in that case routing is judged semantically from the assistant output. Agent runtimes may validate actual routing_trace separately."
  },
  "cases": [
    {
      "id": "greeting-001",
      "title": "打招呼",
      "manual_case_id": 1,
      "input": "你好",
      "expected": {
        "routing": {
          "mode": "primary_required",
          "primary": "career-cognition-compass",
          "allowed_secondary": []
        },
        "literal_all_of": [
          "CCC"
        ],
        "literal_any_of": [
          [
            "Career Cognition Compass",
            "职业认知罗盘"
          ],
          [
            "脱敏",
            "隐私"
          ]
        ],
        "literal_not_contains": [],
        "regex_not_contains": [],
        "structural_assertions": {
          "max_questions": 2,
          "max_characters": 500
        },
        "semantic_assertions": [
          "introduces_core_identity",
          "allows_messy_input",
          "does_not_output_long_feature_list"
        ],
        "semantic_must_not": [
          "generate_full_resume",
          "request_sensitive_data"
        ]
      }
    },
    {
      "id": "messy-input-001",
      "title": "混乱开局",
      "manual_case_id": 2,
      "input": "我现在很乱，gap 一年多，之前做过运营，也学过一点 AI，不知道还能投什么。",
      "expected": {
        "routing": {
          "mode": "primary_required",
          "primary": "career-intake-clarifier",
          "allowed_secondary": []
        },
        "literal_all_of": [],
        "literal_any_of": [
          [
            "Gap",
            "gap",
            "职业空档"
          ],
          [
            "运营"
          ],
          [
            "AI",
            "人工智能"
          ],
          [
            "下一步",
            "小动作",
            "最小动作",
            "10 分钟",
            "5-20 分钟"
          ]
        ],
        "literal_not_contains": [],
        "regex_not_contains": [],
        "structural_assertions": {
          "max_questions": 3,
          "max_characters": 700
        },
        "semantic_assertions": [
          "identifies_current_status",
          "identifies_experience_signal",
          "identifies_evidence_gap",
          "provides_small_next_action"
        ],
        "semantic_must_not": [
          "generate_full_resume",
          "invent_experience",
          "force_structured_input"
        ]
      }
    },
    {
      "id": "positioning-001",
      "title": "隐性职业定位",
      "manual_case_id": 3,
      "input": "我做过运营、活动、社群，也帮产品整理过需求。现在想投 AI 产品或项目管理，但简历看起来很乱，不像目标岗位。",
      "expected": {
        "routing": {
          "mode": "primary_required",
          "primary": "career-direction-clarifier",
          "allowed_secondary": [
            "career-transfer-map"
          ]
        },
        "literal_all_of": [],
        "literal_any_of": [
          [
            "定位",
            "方向"
          ],
          [
            "候选人叙事",
            "职业叙事",
            "定位卡"
          ]
        ],
        "literal_not_contains": [],
        "regex_not_contains": [],
        "structural_assertions": {
          "max_questions": 3
        },
        "semantic_assertions": [
          "identifies_positioning_problem",
          "offers_two_or_three_positioning_options",
          "keeps_options_evidence_based"
        ],
        "semantic_must_not": [
          "invent_new_identity",
          "rewrite_full_resume_immediately"
        ]
      }
    },
    {
      "id": "jd-analysis-001",
      "title": "纯 JD 分析",
      "manual_case_id": 4,
      "input": "岗位：AI 产品助理\n职责：整理用户需求，维护 PRD 和需求池，协助数据分析、竞品调研、功能验收和上线复盘。\n要求：熟悉 Excel，了解 SQL、Figma 或 Axure，能使用飞书 / Jira 做需求协作，理解敏捷迭代流程。\n请分析这个 JD 的核心任务、硬技能、工具要求、短期补强方式和面试可能问什么。",
      "expected": {
        "routing": {
          "mode": "primary_required",
          "primary": "jd-company-prep",
          "allowed_secondary": [
            "career-hard-skill-kb"
          ]
        },
        "literal_all_of": [],
        "literal_any_of": [
          [
            "岗位类型",
            "岗位族群",
            "工作重心"
          ],
          [
            "硬技能",
            "技能要求"
          ],
          [
            "工具",
            "软件"
          ],
          [
            "面试",
            "追问"
          ]
        ],
        "literal_not_contains": [],
        "regex_not_contains": [],
        "structural_assertions": {
          "max_questions": 2
        },
        "semantic_assertions": [
          "classifies_jd_role_type",
          "extracts_core_tasks",
          "identifies_tool_requirements",
          "suggests_short_term_improvement",
          "separates_business_and_technical_questions"
        ],
        "semantic_must_not": [
          "invent_company_details",
          "require_full_resume"
        ]
      }
    },
    {
      "id": "project-mining-001",
      "title": "项目经历深挖",
      "manual_case_id": 5,
      "input": "我搭过一个 Shopify 网站，但没有销售，也不知道这算不算项目。请先帮我梳理它有什么价值。",
      "expected": {
        "routing": {
          "mode": "primary_required",
          "primary": "career-project-experience-miner",
          "allowed_secondary": []
        },
        "literal_all_of": [
          "项目"
        ],
        "literal_any_of": [
          [
            "没有销售",
            "无销售",
            "没有商业结果",
            "无商业结果"
          ]
        ],
        "literal_not_contains": [
          "销售增长",
          "商业成功"
        ],
        "regex_not_contains": [],
        "structural_assertions": {
          "max_questions": 3
        },
        "semantic_assertions": [
          "creates_project_inventory_or_fact_card",
          "separates_personal_contribution_from_team_result",
          "explains_value_without_sales_data"
        ],
        "semantic_must_not": [
          "write_resume_bullet_first",
          "invent_sales_data",
          "claim_business_success"
        ]
      }
    },
    {
      "id": "portfolio-gate-001",
      "title": "作品集项目事实门禁",
      "manual_case_id": 6,
      "input": "我想把过去做过的项目整理成作品集，但现在项目都只有名字，没有详细过程。",
      "expected": {
        "routing": {
          "mode": "primary_required",
          "primary": "career-project-experience-miner",
          "allowed_secondary": []
        },
        "literal_all_of": [
          "DISCOVERED",
          "PARTIALLY_MAPPED",
          "EVIDENCE_READY"
        ],
        "literal_any_of": [],
        "literal_not_contains": [],
        "regex_not_contains": [],
        "structural_assertions": {
          "max_questions": 3
        },
        "semantic_assertions": [
          "requires_project_inventory_first",
          "marks_project_fact_status",
          "blocks_final_portfolio_before_evidence_ready"
        ],
        "semantic_must_not": [
          "generate_final_portfolio_case",
          "create_candidate_story_without_evidence"
        ]
      }
    },
    {
      "id": "resume-edit-001",
      "title": "明确改简历",
      "manual_case_id": 7,
      "input": "我想改简历。我会提供脱敏后的经历片段和目标岗位。请先帮我判断最值得改的地方。",
      "expected": {
        "routing": {
          "mode": "primary_required",
          "primary": "career-materials-builder",
          "allowed_secondary": [
            "jd-resume-patch"
          ]
        },
        "literal_all_of": [],
        "literal_any_of": [
          [
            "脱敏",
            "隐私"
          ],
          [
            "目标岗位",
            "JD",
            "岗位"
          ]
        ],
        "literal_not_contains": [],
        "regex_not_contains": [],
        "structural_assertions": {
          "max_questions": 3
        },
        "semantic_assertions": [
          "responds_to_resume_edit_intent",
          "asks_for_minimum_materials",
          "keeps_suggestions_editable"
        ],
        "semantic_must_not": [
          "force_career_clarification",
          "use_generic_onboarding_template"
        ]
      }
    },
    {
      "id": "evidence-ready-001",
      "title": "无数据项目就绪判断",
      "manual_case_id": 8,
      "input": "我做过一个个人 Skill 项目，没有用户量和商业结果，但有仓库、文档、demo 和版本记录。这样能不能算 EVIDENCE_READY？",
      "expected": {
        "routing": {
          "mode": "primary_required",
          "primary": "career-project-experience-miner",
          "allowed_secondary": []
        },
        "literal_all_of": [
          "EVIDENCE_READY"
        ],
        "literal_any_of": [
          [
            "仓库",
            "repo",
            "GitHub"
          ],
          [
            "demo",
            "Demo",
            "演示"
          ]
        ],
        "literal_not_contains": [
          "必须有销售额",
          "必须有用户量"
        ],
        "regex_not_contains": [],
        "structural_assertions": {
          "max_questions": 2
        },
        "semantic_assertions": [
          "explains_evidence_ready_does_not_require_metrics",
          "checks_goal_contribution_method_output_evidence_boundary"
        ],
        "semantic_must_not": [
          "force_user_count",
          "invent_client",
          "invent_revenue"
        ]
      }
    },
    {
      "id": "temporary-draft-001",
      "title": "临时草稿模式",
      "manual_case_id": 9,
      "input": "我现在赶着投递，项目只整理了一半。请先帮我写一个保守临时版本。",
      "expected": {
        "routing": {
          "mode": "primary_required",
          "primary": "career-materials-builder",
          "allowed_secondary": [
            "career-project-experience-miner"
          ]
        },
        "literal_all_of": [],
        "literal_any_of": [
          [
            "临时",
            "草稿"
          ],
          [
            "保守"
          ],
          [
            "未知",
            "缺口"
          ]
        ],